用户,评论
j***z,第二天就出现这种情况，手感不好，啥也没有
b***6,一般般。 送货服务不行。
A***9,国补是好事，签收成了老大难，不能配送，跑到快递站两趟才解决，折腾人玩
j***h,刚买两天 国补来了 损失500大洋 难受😣
y***9,电池不行，会发烫！才用了半个月左右
l***4,logo有2条刮横，不认真看看不出来！懒得换了
j***m,竟然没有送送充电头和其他小礼品 比如充电宝等 啊啊
w***I,信号不是很好 感觉触屏反应有点慢
j***y,20多天就死机一次了
远***白,苹果的信号是真的差，然后就是贵，其他的也没发现有什么特别之处
j***z,有点拉垮，屏幕有时候失灵，现在还黑屏
道***悠,一定要贴膜再使用，没两天屏幕就划了一道子
-***-,一代不如一代，设置个墙纸能卡住，越来越拉了
j***b,别的就不说了，够用，主要是拍照咋感觉有点朦
j***e,相机拍照卡顿，快递员不送货上门，还要自己跑去快递站取
麻***长,真的不建议购买，电量好拉，啥也没干一半电没了
我***子,是LG的屏幕，心都碎了💔
l***_,国补订单居然说不送货上门，货到了一天都不主动送，还要我家人过去自提，欠揍
j***9,刚刚收到货，有轻微划痕，感觉不像是新的手机呀
8***9,有时候相机打开会卡住，需要退出后重新打开
j***b,没有高刷120还是不太行
他***梦,信号差！！！ 用了几天外放音乐听筒有杂音了！！
哎***的,降价太快前一天买的后一天降一百还不保价，不退差价，不推荐购买还是买遥遥领先吧
多***喜,又卡又烫，屏幕还模糊
j***f,镜头里面有一灰尘，图片又拍不出来，要怎么售后！
一***一,总卡死重启，挺一般的
j***0,网络信号不好，真实使用感受，不吹不黑。
j***u,买了一个自带Bug的手机 不得不换机 京东买东西体验感越来越差了
z***s,一拿到手机色像头就挂机了~苹果顾问还说这种问题挺多的
哥***止,不知道就我是这样还是别人也会这样，经常会信号不好…
J***T,电池还没改进，截图卡屏，信号还是那么差
G***鹏,一般一般，勉强能用。
j***p,刚买一个月降价500😒
h***e,没有配膜，没有手机壳
j***k,老是莫名其妙的关机 不知道什么原因 不知道店里买的好着呢没
j***y,换不了颜色，粉色是真的不好看，不建议给女朋友买！
u***j,外观有瑕疵，拆开的时候没注意，已经使用了没办法
j***e,手机回来以后边框就有瑕疵 没用几天就自动关机
j***j,到我手上那个快递盒子一个角都是扁的然后看到手机他那个手机盒子那个脚那里也是有泥巴刚拿到时候比视频里还要多
心***殇,还没等拆封，就开封了，不知道是不是后封或者路上零下20多度冻开的，持怀疑态度
f***2,手机画面模糊，触屏不灵，激活了又退不了，
j***q,还好吧 有时候会自动关机不知道是不是系统问题
u***z,以旧换新：我是看有以旧换新的福利才购买的，但是为什么我的没有以旧换新的优惠呢
u***n,拍照效果：比较差，还没有安卓的系统好用
j***l,在家正常接打电话，有时候通话，直接没信号。
j***b,怎么回事呀，好几次了
j***u,刚用两天 音量降下去就自己上来 也不知道咋回事
马***匆,包装盒有点脏，国补需要当场激活，机子是正品，开相机有点卡
j***u,电量掉的特别快，不好
h***g,一般般，和12区别不明显
j***8,性号差，打电话有异响
j***g,一般一般一般一般一般一般一般一般一般就是个乞丐版，，，，，，，，，，，，，， ，
j***6,不是……这一开箱就是这样……我还能信这是正品吗……
j***O,用了一个月，自动关机两次了，电池也不太行
7***a,感觉屏幕不清楚拍照后也还要xr拍照后清晰度好质量真越做越差了
j***k,续航差，手机卡顿掉帧，动不动提醒你关机重启
j***d,没想到16的价格波动这么大，价格不停的变动，买得心理确实不太舒服
C***k,买完不到20天发现降了300块，我都还没有开始用，价保也用不了，避雷！避雷！
蜗***手,感觉国补来的货不咋样。包装反正是很破，一个压坏的破盒子就来了。。
j***f,续航不太好，出去拍照的话100电只能用3个半个小时
j***o,到现在已经自动关机两次了，一次在打王者一次在通话中
0***3,商品ok，配送快，价保无用，联系客服价保结果送的优惠券不能用了，客服服务差，现在的京东不是以前的京东了
j***e,刚买不到一个月，司机好几次了。还是要在专卖店买才行.
j***b,摄像头磕手，屏幕白色均匀度一般，后悔买了，早知道等se4的
j***c,我这台是京东方屏，显示效果不如三星屏通透，想要三星屏的下单前一定要问明白
j***4,不知道咋滴… 有点卡壳
x***u,感觉就那样，不好不坏，和以前款区别应该也不大
j***x,app没法下载，去线下店花钱换了个系统才能用
S***e,声音控制失灵了，没有办法静音，网络也是真的差
杨***店,一般，经常崩溃，重启，
C***7,机子暂时还没发现问题，但盒子就有事了，都磨砂皮了又脏
j***u,不差预算的话建议Promax的高刷，并且这个白色没有15的蓝色好看，至于质量问题暂时还不知道
P***U,一般吧，电池续航不行，还没有我原来的13好用。
j***i,新手机买来升级过程中就卡在了你好界面，要求退换客服不予理会，最后打了12315。
u***r,手机价格确实便宜。但是不知道为什么发票上的手机串号，比手机上多一个字母。
j***s,感觉电池的电量不耐用，甚至比不上我用了三年多的13。
j***K,新机器屏幕就有划痕 着急用懒得换了 京东注意下品控吧
白***瑕,不好用，卡顿，打字也慢。加载显示也慢，买了后悔系列。
a***-,以旧换新 旧机现场压价了 远低于线上估价 而且少用了六百元券 价格不划算
9***g,旧的电源线和有线耳机都不能用，没有感觉更换有什么意思
u***h,还行吧，用了半个月多摄影头就出问题了，质量不好
浩***3,外形外观：摄像头有灰，不知道为什么京东自营还会出现这样的问题
j***j,感觉一般，而且实际的价根本没那么低，不过手机还行，
雅***学,除了屏幕边缘不灵敏其他还好以后买还是实体店吧京东换货太麻烦还得检测
j***p,虽然有国补。上来也不让买家检查外观。直接开机激活
u***b,不知道为啥，熄屏了打开会有一点点卡，用一会儿了就好了。
j***b,不知道买手机居然没有充电器，手机到了又去买充电器
j***c,流畅度还可以电池不耐用在冬天拿不出去手体验非常不好的商场有时候没有信号
j***z,会自动关机（不知道什么原因），打电话时莫名其妙突然有杂音
j***p,我第一在网上买六千元的手機📱，而且手機外面還有瑕疵，以後我都不敢在網上買这么贵的東西
4***w,手机用一会或者充电会巨烫，我服了，巨烫，我以为都要爆炸了
o***i,旧款换新款挺划得来的，就是爱回收配送。配送舒服慢了一天。本来是昨天送到，今天才送达
今***i,体验还可以吧，但是有时候相机打开有些卡顿，不懂怎么回事
深***蓝,手机没毛病，但是京东这个保价规则太影响消费者心态了，时间短，降价变化快，逮到一个算一个，真有意思！
j***r,除了反应有点延迟，长视频发不出去，其他的还能接受
u***2,充电刷视频发烫，不充电打游戏的时候也发烫，不知道到了夏天咋办
j***9,以旧换新：以旧换新体验感差，回收取件速度慢，后续流程估计也拉。
j***z,电量没有介绍的那么好，最多只能用一天，还不能看太多视频。
愤***颖,建议大家不要着急买，开始发货发个破破烂烂的，换货后手机收到当天价保就没了，没过两天又降价了，价保也没有，客服也不管，说价保时间过了，我手机拿到才四天，就降价。
j***q,打开相机卡顿 转换摄像头也卡顿 ，收货也要发序列号给快递员。
j***x,16屏幕有延迟，比不上15pro，换了才知道，有点划不来。
j***s,使用还没有一个月，扬声器没声音了，不知道有没有一样情况的？
j***8,不知道是不是苹果的通病，信号差，而且有时会断触，卡顿
j***n,还行 就是快6000元的东西连个充电头都没配 不满意
不***一,也不知道是质检没弄好还是什么，自带的充电线一周就坏了。
j***y,果然一分钱一分货，不是很好用不够prom好用的，反应也有点慢，
8***8,一般般吧，国补收货好麻烦，要知道都不这么买了，搞了好久好久
j***n,手机容易黑屏 拍照检查拍黑的出来 卡顿 可能是翻新或者其他的
世***修,新机电池就只能正常用一天…打接电话少 刷视频也就个把小时…
咔***k,手机质量一般般，出现了点问题，再用一段时间看看怎么样
V***V,双十一活动期间的价保服务不是很满意，金融优惠幅度不一样无法享受价保。手机的运行使用现在用着还是挺好的。
u***v,花了大几千的东西、包装简陋。打开包装手机壳子上一个黑黑的手指印。
w***k,对于独处时喜欢外放音乐的人来说，扬声器有呲啦声真的很致命。已申请换货，换货需要多久也不知道。耽误我使用
看***处,屏幕右上角有两条细微划痕，已激活，退不了了。买这些回，第一次遇到。
薰***枫,昨天买回来今天刚用就发现问题了，接打电话经常没声音，还会自动挂断
j***f,包装盒很脏磨损明显 开出来的手机有灰有污渍 但手机是好的就算了
j***t,以旧换新：拍照卡顿，看一会直播手机就热了，不知道是不是质量问题
冬***n,突然关机，这种情况已经 3 次了。大家有没有遇到过这种情况(ﾟДﾟ≡ﾟдﾟ)!?
u***m,使用过程偶尔有卡顿、断触情况，玩个保卫萝卜偶尔都能卡到界面不动，慎买
j***s,iPhone 16 128G 左上角触感间断性失灵 无法返回 有点扎心啊
j***婆,我买得比别人贵，同样的产品没有享受到补贴，没有提示客户不能和其他商品一起拍 京东应该承担一些责任
Q***f,用了不到一个月就开不了机，用去维修了几个星期了，还没寄回来😓
4***e,机身后盖比较脆弱，一不小心摔一下就有裂缝，需要保护好
h***9,跟pro没法比，一用就发热，60hz屏幕跟幻灯片似的，由奢入俭难啊
j***i,不肯上门，一定要我去代理点，写着送货上门结果要自己开车去拿，机子没问题，盒子有点脏。
j***n,扬声器异常最小声音听着都很大！！ 屏幕音效：异常
j***k,怎么说呢，既然是搞活动，说实话，送充电器比送那个什么保值2年维修要好啊，至少让用户可以二选一嘛，自己去买个充电器还要几百
羊***怪,还是有点瑕疵的，手机很好，就是有一道划痕，客服说可能要花挺长时间换货，随他去吧，
n***d,快递包装破损，有怀疑手机是否有被替换过。客户体验感不好，快递小哥一句话你可以拒签就完事。京东自营和京东快递，要给客户信任感
j***d,用起来有点卡顿 电量基本每天都要充两次还是在不打游戏的情况下
j***n,收到包装破损，外盒脏，不知道24小时可以申请赔偿，所以没有申请到。大家购买后如果包装有问题一定要24小时内申请售后。
j***t,手机坏了，觉得京东速度快今天买明天到才下的单，结果第三天晚上才到我手里，买个手机买了一肚子火
q***d,用了一个星期，手机发烫好厉害，刚开始还没有，26号开始刷视频烫手
8***r,激活后贴膜才发现手机屏幕有一条划痕，激活了没办法退货，只能认栽了
悦***8,感觉新到手。反应不是很快。 点击多几次app 停在哪。返回不了主页
j***0,哪个返回键老是喜欢失灵点着没反应，天气预报也是老不显示信号也差
_***e,续航差，想出手。。。
没***0,谨慎购买，版本不一样，有些软件下载不了，比如监控视频的移动爱家和莹石云下载不了
j***8,不怎么好用，屏幕，照相很一般，比同价位的国产差，电也差
u***1,对电池有要求的千万别买，不然你看那电量下降会觉得自己买的是个二手的
j***a,新买的，苹果尽然会卡，卡得动不了，要重新开机，我怀疑是烂机翻新，找客服也没有人工回复
绿***瓶,手机总体还不错，就是后面电池盖和中框，有明显的间隙，影响美观
S***8,国补价格很划算，但是这就开不了发票了，感觉左上角触键不灵敏，不知道算不算翻车
一***灾,新国补要求现场拆封，开机验证，感觉好怪，是怕退货吗？如果现场弄时不当心摔碰了算谁的，看在这个价格也就忍了
z***1,商品拆封后发现摄像头有掉漆问题，平台以激活为理由不予换货，体验不佳，后续反复投诉后才进行处理，希望后续能够改进。
是***呦,感觉苹果16不好用，也不知道网购的事，软件动不动退出来😭和实体店一样钱，以后不从网上买了
j***f,手机出现过2次点屏幕没反应，联系售后客服说要去检测才给售后，以后还是去实体店买
-***姐,收到就打开壳子验收，手机没动没激活。不喜欢就寄了回去，居然退不了，七天无理由退货是喊口号呢。
j***0,手机不配充电头，用爱发电吗，讲究环保那就直接把卖价里得充电器的钱去掉
坤***坑,下单的以旧换新 不知道怎么的变成了全价正常购买了 没注意直接拆了 退不了 单独回收旧机差八百多 血亏 客服还没办法修改
j***j,序列号是H开头，设备打游戏说实话不灵敏～跟之前买的苹果手机F开头感觉是有差距的
2***k,分期时注意不要和顺手一单一起，不然你会多出700多手续费，多方投诉解决你也会损失几百元.经验交流
p***4,整体都很好 其他没啥，就是感觉续航不是很满意 反正整体感觉就是一般
懒***起,说实话，不惊艳，新机到手第一天相机卡，有点断触，不能退，不会在平台上买了
u***a,国补买的，感觉很一般，系统有点卡顿，相机打开后过一会才会出来
敬***下,东西还行，但京东的物流和服务真差劲，要不是穷，差这点补贴，真不愿意下载京东
j***o,国补让我成功入坑，手机信号不好，还没我5年前的安卓手机信号好，拆封了售后服务态度挺好，但原则就是不给退。
j***o,国补优惠后买手机性价比很好 但是我这台手机 快递员帮我激活拍照的时候稍微有点粗鲁 毕竟新买的手机 还是挺在意的…… 建议让客户自己激活 快递员拍照取证就行
f***5,购买后就出现了降价，还发放了优惠券。然而，我已经无法申请价保。收到后，不清楚原因，使用过程中连无线会感到卡慢。
j***3,屏幕有个小裂痕，撕膜时没注意，激活用了一晚后去贴膜才发现，唉怪自己倒霉吧
老***星,外包装盒脏的很，里面手机正面有水印，后面有半个指纹印，看看使用情况吧
s***j,音质不好，沙哑的声音，拍照一般……待机时间还行……体验较差！
森***啊,这是第二个手机了，目前正在观察，上个手机刚到手好好的，一个月后各种问题
C***e,手机一般，苹果的品控远不如以前，机身多处脏污，尾插螺丝有一圈圆形划痕，续航一般
j***G,买过45天，降价300元
j***z,续航有点不行，感觉有点跳电。其他都一样，因为之前也是用的iPhone
u***z,纯白背景左边边缘一条有点泛红，中奖了，虽说是通病，但是朋友官网激活也能一直换，京东客服连个活人都没有，只有机器人
q***8,冲着以旧换新补贴买的，就没有等国补，但是以旧换新上门时候检测手机严重压价，因为选择的是先送新机再二次上门回收，所以不好退货了
u***u,用习惯了大一点的对于这款小巧的机身真的不习惯，手感不好，视觉上也不好。
j***D,使用了几天，基本上是一天一充，新机子怎么耗电量这么快，还有不方便的是没有指纹解锁
這***水,本人第一次在京冬自营店购买 i p h o n e 手机，我选择了自营配送，河北省发货，快递包装没有填充物，手机电池不耐用，其它暂时没有什么大问题
4***i,昨天我们刚完成了手机的数据转移，今天用了两个小时手机背部就发热发烫，请问商家是你的手机质量有问题吗？或是电池的问题，希望你能给我们一个满意的答复和解觉方案。
j***4,十分不满意，买了不久就发现拍照摄像头有问题沟通完了，上门取件也费劲
肖***迪,收到手机的第一时间自己没有检查，让粗心老公检查的，后来我发现外观瑕疵，但是因为设置了一通已经激活过，也不能换货，只能怪自己运气不好，给自己添堵
j***x,不知道为什么，有时候切换到照相功能的时候就卡住，我是国补的时候买的，感觉还没我的13好用，不敢肯定是不是全新机了
j***k,一言难尽，频繁出现闪退和无法拍照，黑屏的问题。网购手机最差体验
j***o,不要买苹果了，现在的苹果不行了，信号差，还卡机，之前买的11用了四年半，都没事
y***0,各种各样的小毛病，但是检测出来又没问题，老是卡页面还有时候扩音器炸声卡顿
d***8,屏幕音效：屏幕是京东方的 拍照效果：摄像头是高伟电子。 便宜的价格用的器件都不太好！大家还是且行且珍惜吧！
u***7,右下角缝隙这里刚打开就看着有脏东西，像是用过的，但是手机打开看不出什么问题～
7***f,充电线是假的，昨晚充电发生意外了，插口都在融化，还发出火花，臭味
j***7,再也不买苹果手机了 还不如千元手机呢 功能都是苹果专用 没有无理由退货 不然就退了 霸王条款
j***8,16屏幕左侧一排触摸不灵，经常点击无反应.一直用苹果手机，以前没有这种情况，挺影响使用手感.
j***1,刷久了会黑屏，刷新率也不行，像素一般般，价格也不实惠，黑色不好看。
4***3,外观瑕疵的概率挺大的，换了一次还是有个小凹坑，想想还是开机激活了，希望不要有质量问题吧
Z***J,一般吧，买个手机居然不配充电器，出厂膜都没有一个，电池也不耐用
十***汤,手机质感不错 苹果 系统 不是很方便 信号差充电满 而且降价太快了。
J***然,买早了，刚买完半个月就碰到湖北的国家补贴。现在买的话可以再优惠500元，找客服了但不能补差价，感觉自己亏了啊，希望政策能有所调整，而且因为之前买了一个，现在限制半年只能买一个有点不开心了
c***o,从12换成16，没感觉有什么不一样的，主要是12内存不够用了，感觉12换个电池还能再战5年。
q***g,膜都没有，服了……
C***J,手机感觉还可以，就是这配件太少了 连个充电器都要自己买买回来还不能有 还要等充电器。
京***u,怎么会自动关机？电池也不行一天要充两次电，不打游戏就正常刷刷
I***l,国补绑定了个保修，还是质量问题才保，意外摔坏不保，那要保修有何用，还不如线下店去买呢，我真服了
j***p,拍照一如既往的差，跟普通的安卓旗舰都没法比。屏幕发黄，显示效果跟我几年前的se2没法比。体验实在一般。
